{
  "rate_table_id": "DEN-1000-2026A",
  "plan_id": "DEN-1000",
  "plan_year": 2026,
  "currency": "USD",
  "rate_basis": "flat_monthly_per_member",
  "age_bands": [
    "18-29",
    "30-39",
    "40-49",
    "50-59",
    "60-64",
    "65-99"
  ],
  "rates_by_state": {
    "AL": {
      "18-29": 27.264,
      "30-39": 28.944,
      "40-49": 31.488,
      "50-59": 34.752,
      "60-64": 38.16,
      "65-99": 41.376
    },
    "FL": {
      "18-29": 30.672,
      "30-39": 32.562,
      "40-49": 35.424,
      "50-59": 39.096,
      "60-64": 42.93,
      "65-99": 46.548
    },
    "GA": {
      "18-29": 28.4,
      "30-39": 30.15,
      "40-49": 32.8,
      "50-59": 36.2,
      "60-64": 39.75,
      "65-99": 43.1
    },
    "TN": {
      "18-29": 27.832,
      "30-39": 29.547,
      "40-49": 32.144,
      "50-59": 35.476,
      "60-64": 38.955,
      "65-99": 42.238
    },
    "TX": {
      "18-29": 29.536,
      "30-39": 31.356,
      "40-49": 34.112,
      "50-59": 37.648,
      "60-64": 41.34,
      "65-99": 44.824
    }
  }
}
