{
  "rate_table_id": "HI-1500-2027A",
  "plan_id": "HI-1500",
  "plan_year": 2027,
  "currency": "USD",
  "rate_basis": "flat_monthly_per_member",
  "age_bands": [
    "18-29",
    "30-39",
    "40-49",
    "50-59",
    "60-64",
    "65-99"
  ],
  "rates_by_state": {
    "FL": {
      "18-29": 13.392,
      "30-39": 14.9688,
      "40-49": 17.3016,
      "50-59": 21.114,
      "60-64": 24.948,
      "65-99": 30.1104
    },
    "GA": {
      "18-29": 12.4,
      "30-39": 13.86,
      "40-49": 16.02,
      "50-59": 19.55,
      "60-64": 23.1,
      "65-99": 27.88
    },
    "NY": {
      "18-29": 14.756,
      "30-39": 16.4934,
      "40-49": 19.0638,
      "50-59": 23.2645,
      "60-64": 27.489,
      "65-99": 33.1772
    },
    "TX": {
      "18-29": 12.896,
      "30-39": 14.4144,
      "40-49": 16.6608,
      "50-59": 20.332,
      "60-64": 24.024,
      "65-99": 28.9952
    }
  }
}
