{
  "rate_table_id": "CI-3000-2027A",
  "plan_id": "CI-3000",
  "plan_year": 2027,
  "currency": "USD",
  "rate_basis": "per_1000_of_benefit_monthly",
  "age_bands": [
    "18-29",
    "30-39",
    "40-49",
    "50-59",
    "60-64",
    "65-99"
  ],
  "rates_by_state": {
    "AL": {
      "18-29": 0.5952,
      "30-39": 0.8448,
      "40-49": 1.4784,
      "50-59": 2.6016,
      "60-64": 3.8976,
      "65-99": 5.9328
    },
    "FL": {
      "18-29": 0.6696,
      "30-39": 0.9504,
      "40-49": 1.6632,
      "50-59": 2.9268,
      "60-64": 4.3848,
      "65-99": 6.6744
    },
    "GA": {
      "18-29": 0.62,
      "30-39": 0.88,
      "40-49": 1.54,
      "50-59": 2.71,
      "60-64": 4.06,
      "65-99": 6.18
    },
    "TN": {
      "18-29": 0.6076,
      "30-39": 0.8624,
      "40-49": 1.5092,
      "50-59": 2.6558,
      "60-64": 3.9788,
      "65-99": 6.0564
    },
    "TX": {
      "18-29": 0.6448,
      "30-39": 0.9152,
      "40-49": 1.6016,
      "50-59": 2.8184,
      "60-64": 4.2224,
      "65-99": 6.4272
    }
  }
}
